{
  "protocol": "oaiy-relay/1",
  "title": "Sealed tokens from the pairing rendezvous",
  "about": "What GET /v1/pair/{pid} returns as sealedToken once the owner has approved, recorded from the real relay. The phone opens it with the X25519 secret it made for the pairing; nothing else opens it. See README.md in this folder for the format and for what a Rust reader calls.",
  "format": {
    "box": "libsodium crypto_box_seal: an anonymous sealed box (X25519, XSalsa20-Poly1305)",
    "encoding": "base64url without padding (canonical: unused low bits zero)",
    "layout": "ephemeralPublic (32 bytes) || tag (16 bytes) || ciphertext (the same length as the plaintext)",
    "nonce": "BLAKE2b with a 24 byte output over ephemeralPublic || recipientPublic",
    "key": "crypto_box_beforenm: HSalsa20 over the X25519 shared secret of the recipient secret and ephemeralPublic",
    "plaintext": "the ASCII device token: \"oaiyrt1.\" + 11 characters + \".\" + 43 characters, 63 bytes. It is never written in this file: plaintextSha256 is the check.",
    "refuse": "a box that does not authenticate, a length under 48 bytes, or an X25519 shared secret of all zeros (a small-order ephemeral key), even when the box authenticates under the key that shared secret gives (refused[8] and refused[9])"
  },
  "recipient": {
    "note": "The test phone of Appendix A3: a fixed public test key, never a real one.",
    "x25519Secret": "4uLi4uLi4uLi4uLi4uLi4uLi4uLi4uLi4uLi4uLi4uI",
    "x25519Public": "GdgCBL-F8-ERjhsjQQyI8NDuztUVb0xb3zR7FO1-xj8"
  },
  "opens": [
    {
      "label": "the token of the recorded ceremony",
      "sealedToken": "QRbWxPtdAN-uyocAKy54Fvpd4zNEYMd5QM_5y9HeZhSb5q33oGPZbaJuRKirVxIkMtSzDBAiD1EroLbSY9Ob5I5SZjNGrVWEe0_29Vyj4HL2zkr_BaeE7lXg538CykjZKZ0vOHz_tx2F75GPJCcY",
      "sealedBytes": 111,
      "plaintextLength": 63,
      "plaintextSha256": "611b6b4d0742b551ebcbaca2e04aac99d598fb66c30b66e61c57dcac990fab65"
    },
    {
      "label": "another ceremony, token 2 (a fresh ephemeral key each time)",
      "sealedToken": "6dG9Ku9Ndv3JyXZO8FBbft-iE9_xVUEoxMOOx_F9mRnFrp1-Qkrnto9uNnbrfzmFYFa1-fUqJ8KvKrEUSjZvrleMQ5LOnSR2JZlr1zO5eVM9Uqr1hcjq6eVGxx9Bk97voGYQDTpsz55Oz7ftKGSp",
      "sealedBytes": 111,
      "plaintextLength": 63,
      "plaintextSha256": "fac644c69b3a9b45e9eb4a2d811f02cf1a3f3c783c000d9a16cea3277797d1fd"
    },
    {
      "label": "another ceremony, token 3 (a fresh ephemeral key each time)",
      "sealedToken": "NH3tWZwR8S6RO8ia3p_U56vVwCH2UARSVP5wCqbHVkdW0f9iZTDS0F0eIBFs7R1ba1boGGyq-VKn2GO1WETe5vgB25XMreCh_aXhikqCfLsg0iNnTeELvirCFbqyXMgVze9H_Vn8a55LEhPEko2c",
      "sealedBytes": 111,
      "plaintextLength": 63,
      "plaintextSha256": "d366826191d4a31eee493ba48f238046fb196ce102cb65447c73beababb197ac"
    }
  ],
  "refused": [
    {
      "label": "one bit of the ephemeral public key flipped",
      "sealedToken": "QRbWxPtcAN-uyocAKy54Fvpd4zNEYMd5QM_5y9HeZhSb5q33oGPZbaJuRKirVxIkMtSzDBAiD1EroLbSY9Ob5I5SZjNGrVWEe0_29Vyj4HL2zkr_BaeE7lXg538CykjZKZ0vOHz_tx2F75GPJCcY"
    },
    {
      "label": "one bit of the authentication tag flipped",
      "sealedToken": "QRbWxPtdAN-uyocAKy54Fvpd4zNEYMd5QM_5y9HeZhSb5q33oGPZbaNuRKirVxIkMtSzDBAiD1EroLbSY9Ob5I5SZjNGrVWEe0_29Vyj4HL2zkr_BaeE7lXg538CykjZKZ0vOHz_tx2F75GPJCcY"
    },
    {
      "label": "one bit of the ciphertext flipped",
      "sealedToken": "QRbWxPtdAN-uyocAKy54Fvpd4zNEYMd5QM_5y9HeZhSb5q33oGPZbaJuRKirVxIkMtSzDBAiD1EroLbSYtOb5I5SZjNGrVWEe0_29Vyj4HL2zkr_BaeE7lXg538CykjZKZ0vOHz_tx2F75GPJCcY"
    },
    {
      "label": "the last byte removed",
      "sealedToken": "QRbWxPtdAN-uyocAKy54Fvpd4zNEYMd5QM_5y9HeZhSb5q33oGPZbaJuRKirVxIkMtSzDBAiD1EroLbSY9Ob5I5SZjNGrVWEe0_29Vyj4HL2zkr_BaeE7lXg538CykjZKZ0vOHz_tx2F75GPJCc"
    },
    {
      "label": "a byte added",
      "sealedToken": "QRbWxPtdAN-uyocAKy54Fvpd4zNEYMd5QM_5y9HeZhSb5q33oGPZbaJuRKirVxIkMtSzDBAiD1EroLbSY9Ob5I5SZjNGrVWEe0_29Vyj4HL2zkr_BaeE7lXg538CykjZKZ0vOHz_tx2F75GPJCcYAA"
    },
    {
      "label": "shorter than an ephemeral key and a tag (47 bytes)",
      "sealedToken": "QRbWxPtdAN-uyocAKy54Fvpd4zNEYMd5QM_5y9HeZhSb5q33oGPZbaJuRKirVxI"
    },
    {
      "label": "an ephemeral key of small order (the identity), with the rest of a real box",
      "sealedToken": "AQAAAAAAAAAAAAAAAAAAAAAAAAAAAAAAAAAAAAAAAACb5q33oGPZbaJuRKirVxIkMtSzDBAiD1EroLbSY9Ob5I5SZjNGrVWEe0_29Vyj4HL2zkr_BaeE7lXg538CykjZKZ0vOHz_tx2F75GPJCcY"
    },
    {
      "label": "an all-zero ephemeral key",
      "sealedToken": "AAAAAAAAAAAAAAAAAAAAAAAAAAAAAAAAAAAAAAAAAACb5q33oGPZbaJuRKirVxIkMtSzDBAiD1EroLbSY9Ob5I5SZjNGrVWEe0_29Vyj4HL2zkr_BaeE7lXg538CykjZKZ0vOHz_tx2F75GPJCcY"
    },
    {
      "label": "an ephemeral key of small order (zero) whose box authenticates under the all-zero shared secret",
      "sealedToken": "AAAAAAAAAAAAAAAAAAAAAAAAAAAAAAAAAAAAAAAAAAAbC4P43GGYIdc1bUSywdIjibJaj6tevozDgBEUVR0W2riNzHT9NQrKASjkGjZNJ56Oee8Sh23cNyM6c-d1KKdnK_Fi80-SJb8FsOY0x7dK"
    },
    {
      "label": "an ephemeral key of small order (order8-a) whose box authenticates under the all-zero shared secret",
      "sealedToken": "4Ot6fDtBuK4WVuP68Z_EatoJjeucMrH9hmIFFl9JuADBsHbumxIULzoSU3_LoW0TlrOa2beA1N4kVNZbWyzdW7gZiaPkEWnhd4GEvOhjQPg2M_psNh8u9wF8ekaD8HRdnLug4kXPuWNHSqQmfsXj"
    }
  ],
  "wrongRecipient": {
    "note": "The first recorded token does not open with this other key.",
    "x25519Secret": "oYtbQ5S6dKMHECKu_ffS9Z7FFEF6m7BPSMqSdynlWuU",
    "x25519Public": "CuLbABEg4YrdKvBr9FSSHG3_f-XBe_MrlONWgxxi12Y"
  }
}
